Question,Scaled_Bleu_Score
"What is the diagnosis of a 10-year-old patient, with fever and intense pain, started periumbilical but is now located in the right iliac fossa?",0.2037246216722266
"If a child can't say the 's' sound, can that be changed?",0.12778778642229083
"If a child isn't speaking by the time they are 3, will they ever speak?",0.09838476200630968
What are modifiable risk factors for breast cancer?,0.08120351265906096
The occurrence of vulvoperinal condylomatosis in the university community has increased in the last 6 months. What preventive measure should be used to reduce the incidence of the disease?,0.08805135333429341
What type of genu valgum is normal?,0.07468620780110698
Explain how kinesiology tape reduces swelling.,0.10634060200238178
What is the treatment of choice for a squamous cell carcinoma located at the palpebral margin of the eye?,0.2704655949104223
"A patient comes for consultation with burns over 25% of his body surface, of varying degrees all over his body, what is the indicated treatment for this patient?",0.02790220453320335
How do I say that I don't want to work with a patient who has been aggressive to me in the past?,0.14857144232206007
How do I say no to treating a patient?,0.06401588640837434
"In a hypercholesterolemic patient who has suffered an acute myocardial infarction, what is the target for LDL cholesterol?",0.14668981713867738
"You have a patient admitted for upper gastrointestinal bleeding, the endoscopy reveals a gastric ulcer in incisura angularis with a point of hematin and minimal traces of dark blood in the stomach. Biopsies of the ulcer margin and an antral biopsy are performed for the rapid urease test with a positive result. What is the next step?",1.6594608805754903e-78
A 20 year old male is suffering severe headaches with visual disturbances. Is it likely to be a brain tumour?,9.895369726533401e-79
"A 52 year old male is experiencing fatigue, night sweats and has lots of bruises. What is likely to cause this?",0.06125913195713591
Would we be healthier if we switched from a reactive healthcare system to preventative?,0.07685772722054367
What potential problems could arise if we rely more on gene therapy with our current regulations?,0.11459544642387527
The doctor prescribes an intravenous therapy with the wrong dosage but I know which one is right and I postpone it. Is this wrong?,0.08028397257096032
"I'm alone during the night shift because my colleagues are busy with other patients, a patient on isolation calls me urgently because he's sick. Can I go to the patient leaving no one to supervise the rest of the ward?",0.05032861320831789
What is an EHCP?,0.06032490741337839
What is Developmental Language Disorder?,0.09562823122583929
How do you work with resistance in psychotherapy?,1.2278362041531958e-78
"If you were faced with a patient who had multiple comorbid psychiatric disorders, how would you formulate a treatment plan?",0.10390678401834484
What happens if fat cells also immerses into tendons and not just muscle cells. will this affect connectivity and size of tendons?,0.055834097542902396
"If upper limbs suddenly become stronger than lower limbs, will people start walking on their hands?",0.046712658961693625
"Someone thinks they took their dosage of hypertension medications, and may have taken them again in the morning. They have dementia and cannot remember. What can be done?",4.721552572325899e-155
"If the patient shows no physical symptoms, including tests, yet they state they are feeling unwell, what do you do?",6.071325084112736e-79
What should I do in the event I am attacked by a young person in care?,1.5726902959468381e-155
What restrictions are there in fostering?,1.1734337110412025e-78
"I'm a 50 year old female, in menopause. I feel pain in my right breast. Should I be concerned?",0.03896180024205101
"I'm a 67 year old man, with hypertension and I'm a heavy smoker. What exams should my doctor perform and what are some recommendations regarding prevention?",4.082366684767528e-155
Do you need a specialist portfolio to become BMS band 6 if you have master’s degree in Biomedical Science?,0.03324495275484164
You have two analysers. One breaks and you have to do some maintenance on the other one. How do you do it if you still have to test the urgent blood samples?,1.2529320848604528e-78
"If Patient A is diagnosed with Multiple Sclerosis in Africa and they move to Canada, would their disease be worse or better? ",0.0872380755586116
"If Patient A takes a CGRP antagonist and a Gepant, would they benefit more than just having one medication?",0.03996072445658427
Which component of EMDR therapy has the biggest evidence for its efficacy?,0.0627291186082019
How can Rasch analysis inform the analysis of Patient Reported Outcome instruments?,0.0533009140569193
How can I perform lung function testing without putting strain or discomfort on the patient?,0.08556243040714454
Compare AI interpretation of test results accuracy to a health professional following the same standards for evaluation.,1.2582798575454497e-78
"A male presents with jaw pain, central chest pain and a fear of doom. What is the likely diagnosis?",9.089047785755588e-79
A male presents with severe abdominal back and abdominal pain that is resistant to pain relief. What is the likely cause?,0.06961339479330794
Suppose I have a 30 year old lady of child bearing potential and has severe scarring acne vulgaris. She merits treatment for isotretinoin but refuses to have contraception. Is this acceptable?,0.1365747953653625
Suppose I have a 45 year old gentleman who has severe atopic eczema and has failed numerous systemic agents like ciclosporin and methotrexate.  He is also currently planning on fathering children. Is it reasonable to start him on dupilumab injections?,0.09923510550050658
"A case presented, 45 year old female, presents only some mild dyspnea, 4 hour evolution. She has a chest X-ray that was taken yesterday and you identify cardiomegaly. How do you measure the grades for cardiomegaly?",0.05509541561063522
How can we determine which artery is blocked in an AMI using an EKG?,0.05929834043068476
"A 33 year old male has presented with suicidal thoughts, self harm and a risk of violence towards others. Does he meet the criteria for sectioning under the mental health act?",0.02361069312959942
A 16 year old girl presents with typical symptoms of emotionally unstable personality disorder. What are these symptoms and is she eligible for diagnosis of this disorder?,0.023627405189916535
"You are stood down from a bit breathing job due to a caller stating a DNAR is in place but around 30 minutes later it comes out that the patient choked, with the DNAR excluding reversible causes. With the patient not breathing for over 30 minutes, the family not wanting resuscitation, what is the best action course? ",0.058945426690913835
A patient who has sustained an opioid arrest has now received narcan and is refusing hospital treatment or to leave the ambulance - is it correct to call police?,0.15711806732326497
"If a person shows stage fear, what could be the main reason and what can be the perfect solution for it?",0.08701211498557919
How can you understand the mind of a politician while his speech?,0.05029004663561212
What are the neurotrophic effects of GnRH on motor neurons in the spinal cord?,0.09972468879161815
"If we apply GnRH to cultured neurons and observe neuritic growth, what would be the possible mechanism of action of this hormone on neurons?",0.12173210186065275
How can we support people through addiction and homelessness?,0.06208392809643829
"Which psycho-therapeutic approaches would you take with a client addicted to substances, traumatized by childhood abuse and having a dissociative personality disorder?",7.84320611348355e-232
What is the best type of socket for a diabetic amputee?,0.1032631650921284
What is the best kind of suspension for an amputee?,0.15605815356255526
"A 76-year-old man who consulted for cognitive impairment, slowness and clumsiness of movements, of eight months of evolution. The family reports that the patient presented visual hallucinations, for which reason his Primary Care doctor prescribed low doses of risperidone, with a significant worsening of motor status. In view of these data, what is the most probable diagnosis?",7.259419553339045e-232
"A 29-year-old obese woman with no relevant history, who consulted for intense, bilateral, throbbing headache of one month's duration, accompanied by horizontal diplopia and episodes of monocular amaurosis lasting seconds. The examination is normal, except for the presence of bilateral papilledema. Which of these tests do you think will allow you to fully confirm your diagnosis?",0.11699669823707445
"A person with a learning disability is driving a car and hits a road user, will he or she be charged?",0.13603698996399569
"As a person supporting a disabled person, if the service user is agitated towards me and I retaliate, what are my chances against the law?",0.15984678261761137
"I contracted a strain of Bacillus subtilis, which has a mutation in a gene. Therefore it cannot live well at 37 degrees Celsius. When I introduce a functional version of this gene to the mutant strain, it cannot recover itself and cannot live at 37 degrees Celsius. Is this possible?",0.13684524575973514
I found a protein expressed in both humans and Pseudomonas aeruginosa. They have quite similar protein structures but completely different sequences and functions. How could this happen?,0.03351908598997055
"Under age girl going through labor about to give birth to her second child asks to have a permanent contraceptive method against her parents will, what do you do?",3.453386583574231e-155
"Patient that claims to be a jehovahs Witness in critical condition that urgently requires a blood transfusion but has not given his consent, what do you do?",0.03151021985232915
What's the best test for screening of diabetes mellitus type 2?,0.10918434868091323
Is serum antibody related to hashimoto's thiroiditis?,0.07937187162449326
"A kid refuses to brush his teeth and the parents feel helpless, how could I motivate the child to brush their teeth?",0.08117089364337164
Do cavities have a genetic cause?,0.13577703120476428
I have a patient with abdominal pain for 3 days. What is the protocol I should choose when the patient arrive to the CT scan?,0.044064515950630205
I have a patient with a kidney stone. Should the patient do an ultrasound or a CT scan?,3.3359433442420416e-79
"Supose there is a 28yo male patient who presents with blood vomiting after attending his graduation party, which is the most likely cause of the bleeding? ",0.07864233655787405
"Supose there is female 30yo patient who is pregnant of 32 weeks, she presents with moderate transvaginal bleeding and no other symptoms, what would be the best initial course of action to address this patient? ",0.12644985978107043
What is the best way to maintain a healthy body weight when you are already eating healthy and exercising but can't find positive results?,0.15980155010216415
Why are infant formula brands not necessarily promoted to pregnant and lactating women?,0.12157691372987167
What are auer rods? ,0.04042370508112307
What's the difference between lymphocytic and myeloid leukemia? ,0.10168974604645087
A group of patients presenting with diarrhea 6 hours after eating out in a restaurant. The patients reported eating salads and meat. What are the most likely agents causing such disease? ,1.6932770163747391e-155
A male with 80 years old presents with chronic cough for the last two years. What should you order to study the patient's condition?,1.6505007164486634e-155
"There is a 3 years old kid, that was playing in the yard and fell from 2 meters, what would you do?",9.598888475853186e-79
"You have a 2 years old kid that hasn't reached his normal height, and he has a gasometry with metabolic acidosis, what else would you ask for if you are suspecting of renal tubular acidosis ?",1.725531576483022e-78
"A patient comes in with frequent asthmatic episodes, what should be monitored in such a patient?",1.9180709031040057e-78
What are the steps in a cranial nerve exam?,1.0300341100268283e-78
"If a doctor walking down the street sees a person collapse on the ground, what should he do?",0.09616277265991825
"If an obese patient who wants to lose weight goes to the doctor's office, what would be the first steps to follow?",0.10794157982239579
"A patient presents with low platelet count. All investigations done are inconclusive, what is the next step?",1.7097872680874517e-78
Imagine a patient presents with high grade fever. All the investigations done are negative and we are unable to find the cause of the fever. What could it be?,9.664969255392588e-232
Can babies under 3 take lactulose?,0.10876569038393559
With hypertension can you take oral anti inflammatory?,0.13647852524766074
Can you summarize the standard procedure to treat a recurrent eczema on children? ,0.08959029264846242
"A 12 years old male patient is taken to the office by his mother. He was bitten by an animal 20 minutes ago, the mother has no idea what type of animal it was, what is the immediate treatment?",0.17861861633156548
"If a 90 year old male has high level of frailty, lives alone and high risk of falls, should he live home alone without a package of care? ",0.05455053804469011
How does a family living in the north east of England seek support for their own mental health when they have a family member with memory problems but who is declining the diagnostic process for dementia?,0.07495539963730807
Who is the medical technology leader for Image guided therapy and where can I find data that supports that?,0.10245114310804511
Assume I wanted to come up with a new approach for treating heart diseases using image guided therapy system and i want to develop a brand new system. What would be the steps needed to assess the required development steps for such system?,1.8552458579607953e-155
How can we prevent the next pandemic?,0.052687860518497207
How can one effectively manage a clinic and also ensure top notch patient care?,0.047890172565069715
How would you deal with a situation where you are being threatened physically?,1.0849162614822189e-78
How do you plan on providing the best care possible without being unprofessional?,0.0397216479481646
What type of health supplies require approbation?,0.07248064775017714
To what extent should there be regulations of medical devices?,1.7279834840141917e-78
"A 45-year-old woman presents to her doctor with a one-month history of fatigue, shortness of breath, and easy bruising. She has no significant past medical history. A blood test reveals anemia, leukopenia, and thrombocytopenia. A bone marrow biopsy is performed and reveals chronic myeloid leukemia (CML). The patient is referred to a hematologist-oncologist for treatment. The hematologist-oncologist discusses the treatment options with the patient, which include tyrosine kinase inhibitors (TKIs), allogeneic stem cell transplantation, and supportive care. The patient decides to undergo treatment with TKIs. What are the advantages and disadvantages of treatment with TKIs for CML?",0.053491806401473906
"A 55-year-old man presents to his doctor with fatigue, shortness of breath, and easy bruising. He has no significant past medical history. A blood test reveals pancytopenia, which is a decrease in all three types of blood cells: red blood cells, white blood cells, and platelets. A bone marrow biopsy is performed and reveals acute myeloid leukemia (AML). The patient receives six cycles of chemotherapy over the course of six months. The chemotherapy is successful in shrinking the leukemia cells, but the patient develops a number of side effects, including fatigue, nausea, vomiting, and hair loss. After the chemotherapy is completed, the patient undergoes a stem cell transplant. The stem cells are donated by a matched sibling. The transplant is successful and the patient is able to go home. What are the potential side effects of chemotherapy and stem cell transplantation for the treatment of AML?",0.11130507873316325
"A female patient is experiencing recurrent urinary tract infections, she has been treated with cefadroxil for seven days but has not shown improvement. What is the correct course of action?",7.653048874486641e-79
Describe the pharmacokynetic differences of lansoprazole and omeprazole and make an argument for which one would be better for an elderly female patient with liver issues.,0.08256845587243174
What is the average human body temperature?,0.14532405608844742
"There is a spillage in my laboratory, and I just walked in to meet it. I don't know the chemical that was spilled, please direct me on the safest and important actions to take.",0.036487935022782
36 year old starting medications for mental health issues - which are most like to cause Long QT on an ECG recording?,7.586831018824814e-232
"I have a patient who has taken venlafaxine for 10 years and has recently stopped due to side effects and now wants a different kind of medication, except an SNRI. What other medication could I give this patient with less side effects but still efficacious?",0.09100858052175223
Can you provide me a list of inclusion criteria in a superiority clinical trial to study a new biphosphonate? ,0.17437767955589706
"30 year old female has an episode of syncope post 2nd COVID vaccine, has a history of palpitations and dizziness - what test would you suggest to be carried out?",0.01971715609272507
A patient with low IQ has trouble sleeping but does not understand the risks of long term benzodiazepine usage. How can I explain it to her in simple terms and also suggest something different?,1.2978206763859961e-78
Can you provide a list of all the different ADR classifications?,3.2856079010283294e-232
Why do people become addicted to heroin?,0.06480982275107265
Can you tell me what I need to get the Industria Verde certification for a company in Ramos Arizpe?,3.6626397502333424e-232
"My company, located in Mexico, fired a person that came to work with a level of alcohol in the blood of 0.009. This person is suing the company due to that decision. Can this person win the sue?",1.0728014782890633e-78
What advances have there been in detox methods for people addicted to alcohol over the last 20 years?,0.04323791166602768
"If the peak value in a virus culture occurs before the peak value of its pcr, what does that say about the virus?",0.11457115675501857
"In a ventilated, corrected gestation, 28+4 week baby with bidirectional PDA, what is the best way of closing the PDA non-surgically?",0.11758040402540525
How would you help a mom with her breast feeding fatigue?,0.04711090744216471
"A patient who is nil by mouth has snuck food in, what are the risk associated if they are due to have an operation in 1 hour?",3.5064015936609213e-155
A 52 year old male is seen as an outpatient with skin lesions that are suspicious of cutaneous T cell lymphoma. Biopsies are not diagnostic and he is instead kept under surveillance. At what point would you consider initiating treatment if further biopsies are equivocal? What parameters would be taken into consideration?,0.038078858013297176
"Suppose a patient has recently undergone orthodontic treatment to straighten their teeth, but they are still experiencing bite problems and jaw pain. The patient is interested in exploring options for addressing these issues, but they are hesitant about undergoing further treatment. What are the potential causes of these symptoms, and what non-surgical options are available for addressing them?",0.07807685724182206
"A 21-year-old woman is going to undergo chemotherapy. The doctors do not assure that if she recovers she will be able to continue to be fertile, she may even have her uterus and ovaries removed. The woman does not have a steady partner now, but she communicates her desire to become a mother in the future. What can she do to preserve her fertility? ",0.05644215948717637
