Question,Scaled_Bleu_Score
What kind of impact does social media have on patients with anorexia?,0.041043554968122675
How do you deal with a patient who is sick but has no pointed symptoms and no health record?,0.06453014907879412
Describes Hodge's blueprints.,9.50943555880892e-79
What is the best way to store my medication to ensure its potency and safety?,0.20409601406997854
"When providing intrapartum care, a midwife can prescribe appropriate pain relief. True or false?",2.1037794765398527e-78
How would you do treat a psychotic crisis?,0.04641791736382413
"A nine year old girl with severe ADHD has already tried all drugs that are allowed for children. None of them was sucessful. There was no benefit from the drugs, but many negative side effects from on just a little dose. What else can I try, if an ADHD patient isn't responding to any drug?",1.1485117719298988e-78
What is the treatment for grade 2 prostate carcinoma?,0.05804525416320789
Is the difference in duties and responsibilities between nurses working in different states justifiable?,0.06870328777434397
What is the prozone error and how does it affect the blood test?,1.4522229027387957e-78
What are the symptoms of a myocardial infarction?,0.04947143276785004
Is one's sphingolipid mileu a factor in psoriasis?,0.05209149238814537
Why do some patients respond to one CGRP antagonist well but not another from the same medication class?,3.711340381105889e-155
What is the difference between the migraine CGRP antagonists? ,0.05605728245792846
"If I have a patient who has chronic migraine and has failed all the available prophylactics' medications, what do I do?",1.5714913353367524e-78
What are the symptoms of an abdominal aortic aneurysm?,0.0976467097602014
Do the medicines used for diabetes foot ulcer work?,0.06531356772294876
What is the ICD-10 classification of severe depression without psychotic symptoms?,0.6413865258981679
How many cardiology subspecialties are there?,1.6564692434647314e-78
Can you tell me what is the best way to get an informed consent?,0.053904561952265194
"Gestational diabetes is a complex medical condition which can present in many ways during pregnancies, what makes an individual more likely to develop this in pregnancy?",4.888703827300311e-155
Which symptoms describes an autistic disorder?,5.366024549904543e-155
How would you promote dignity and respect in care?,0.044183106447900224
How do you manage a desmoplastic blue naevus?,0.05754212353237662
Who should a patient be referred to if a bloodwork shows high protein levels in the blood?,0.04106381386204493
What is the best diet for general longevity?,0.0993517484490641
Why is the category of nurses in Italy little recognized unlike doctors?,0.047153472932969
At which gestation is the Nuchal screening offered routinely?,1.3247634383430357e-78
Can an adhesive capsulitis develop from an osteoarthritic shoulder?,0.3615855225145535
Why are left-handed people stronger using their right hand?,0.06219827675966576
Is metamizol superior than other medications in treating osteoarthicular pain?,0.010823694727639659
"I'm a 60 year old patient, with hypertension and obesity. How low should my LDL be?",0.033216494041350554
What is the reliability of ABR testing for testing toxicity?,0.05144447823430686
What is the recommended medication to prescribe for a first episode of psychosis?,0.13599696382114074
"How do you decide who to put in extra care or try to save, if you are under staffed and 3 people walk in with different injuries, a 10 year old with a head injury, 45 year old women bleeding internal and a 70 year old man with a broken hip?",0.09635532294937069
What level of insurance should pharmacists working in prinary care get if they are not prescribers?,6.429706443856685e-79
What is the average salary for a biochemist in NYC?,0.13730349898168204
How would you be sure to provide discretion and adhere to dpi guidelines?,4.8061619988928574e-155
What is the difference between a drug's pharmacokinetics and pharmacodynamics?,0.1455781619985099
"A patient has presented with low mood, insomnia and anhedonia. Upon assessment they disclose other periods of heightened mood, impulsivity and reduced inhibitions.What are the possible diagnoses? ",6.912165587447274e-79
What would be the symptoms for an urinary tract infection?,1.7097872680874517e-78
Should I use the AVUK strategies with my deaf patient?,1.7352694408015344e-78
What are the differences between Acute myeloid leukemia and Chronic myeloid leukemia?,0.14687662536858032
What are the differences between professions about patients returning as volunteers?,0.019208701041173115
How do you tell the difference between adhesive capsulitis and an osteoarthritic shoulder?,0.04024347778702327
Is rorshach test a good IQ measurement?,0.08580385923835032
What is the diagnosis? A patient was presented with the rush and their blood was grossly haemolysed.,0
Can we ever eliminate all mental illness?,0.07963288370985669
Please provide an approach to the management of a convulsing child.,0.04931863183766537
What is the best type of epidemiological study to assess the causal association between a risk factor and a given disease?,3.709050793403425e-155
Is cancer curable?,1.3665670284672863e-78
What criteria would you use to ensure safe discharge of a child with bronchiolitis?,0.020953174859766933
"A 37-year old woman who lives alone has rheumatoid arthritis, affecting her grip. What meaningful activities might this impact and how could they be adapted?",0.027362799485532316
What are the risks of inserting a nasogastric tube during a night shift?,2.3050357116699136e-155
What is the best biological agent for treatment of hidradenitis suppurativa having failed adalimumab?,0.026903695637075682
"An 80-year-old man is admitted for a sudden episode of aphasia and right hemiparesis. As antecedents, hypertension stands out, well controlled with diet and cognitive deterioration in the last year under study by his neurologist. Emergency head CT showed a left frontal lobar hematoma without contrast enhancement. What is the most likely cause of the bruise?",0.0219616543832939
How can you find out if a person has childhood traumas?,0.051021986963533224
Why some bacteria could cause deadly infections in some people while others can recover quickly?,0.11070465625537211
What could be the possible cause of dementia?,1.410794857169377e-78
"Motor symptoms in Parkinson's disease predominate and define this entity. However, the symptoms in other spheres are sometimes very relevant and are called by the general name of ""Non-motor manifestations of Parkinson's disease"". Which of the following is considered a non-motor symptom of Parkinson's disease?",9.594503055152632e-232
What percentage of Pseudomonas aeruginosa strains do not confer natural resistance to kanamycin?,0.30826276460621843
Tell me about the mechanisms of graft versus host disease (GVHD) in bone marrow transplant patients.,0.11040892886866636
Is a microprocessor controlled foot worth it?,0.04930770374513433
What is the most efficient way to handle local falls pathways? ,0.08031837410066837
Can we give paracetamol to a cat?,1.822884096058233e-78
Why do some antibiotic-resistance genes in bacteria also involved in metabolic metabolisms?,0.09393631423375784
What are the potential benefits and risks of using stem cells to treat haematological disorders?,0.11345536293124316
What is the best most varied option for elective placement? ,0.07801678115028542
What is the perfect solution for an unhealthy family life? ,0.04563106490551901
How can I support caring for those experiencing malnutrition in the community? ,0.07362120672475955
Can you please provide a list of appropriate resources showing best practice in treatment of anxiety?,2.1972363347400483e-155
"A 40-year-old woman who consulted for approximately 20 episodes a day of intense, left periocular pain lasting 15 minutes, accompanied by intense tearing and runny nose. His scan and MRI are normal. What treatment of choice would it be?",8.08357360366746e-232
What is the best material for insoles?,0.03613033082964186
Can a diabetic person take medical products with any kind of sucrose?,0.1508903198039707
What should be the first response to an epilectic seizure?,0.11451340235329491
Can low mobility amputeed benefit from a microprocessor controled knee?,0.12637220362576984
Why should we give fludarabine and cytarabine 4 hours apart when giving these chemotherapy drugs to a patient?,1.0768831401001981e-78
Do I need to fast to have a CT scan? And how about a MRI scan?,1.719434432427134e-79
Why do pregnant women often suffer from iron deficiency?,0.1339403243909137
What is the physiopathology of asthma? ,0.1462268810142721
"What processes need to take place after a suspicious death of a patient who is a recovering heroin addict, where suicide is suspected?",0.03732609879175949
Short right hand and short right leg of newborn and having one kidney at the time of birth what will be the root of this problem?,0.059921252075476106
How effective is cognitive behaviour therapy in the treatment of recovering opiate addicts?,0.07651388405590596
Why does the T wave on the EKG is a positive wave if it represents the repolarization of the ventricles?,0.10821786729633959
What are the intervention strategies to recommend for people with hypertension?,0.09375937747849142
A female patient presents in the ER with pain in the leg and trouble breathing. The patient had a 7-hour flight in the previous day. What is the most recommended course of action here?,0.08032412277181668
What would be the best way to address a case of eating behavior disorder in the medical consultation?,0.13651626926841182
"Dates can cure diabetes, then why do they also increase the blood sugar level? ",2.4634975242623204e-78
"Where can a client go for help if they find themselves addicted to crack cocaine, are being physically abused by their dealer and have recently become homeless?",0.02800454572371555
What is the time to detect a tromboembolism in CT scan after contrast injection?,4.926607026549805e-232
"DNA diseases in newborns are increasing, what could be the cause of it? ",0.07011670848326912
"In the mexican labour law, what is the maximum level of alcohol allowed a person can have in the blood while working?",0.03755700517522461
Where can I find more information about asthma treatment?,0.10938364072143289
"A male, 30 years-old, referred to the ER after his oncologist noted a rash that appeared three months after the patient started chemotherapy for colon cancer. The patient has a rash that is painful and on the right side of the thorax. What is the most likely diagnosis?",0.022515889940778227
What information is currently available on the prognosis of angiosarcomas?,0.06919082271276442
When does it changes from being a Stevens Johnson's Syndrome to a toxic epidermal necrolysis?,0.07962407285698758
"A patient with community-acquired pneumonia, without any alarm signs, CURB-65 of 0. He refers he has had an allergic reaction to penicillin and macrolids in the past. What are the available options for antibiotherapy in this patient?",0.14795551758523895
What is the treatment for a perianal abscess?,0.10440815927955581
At what age kids can make a three block tower? ,1.0832677820940877e-231
"In mexico, what is the official definition of a disability (discapacity)?",0.08275923936328981
"My company, located in Coahuila,  Mexico has 3 processesthat cause emissions to atmosphere. Can I direct those emissions in 1 single chimney or do I need 3 chimneys? What does the law requires?",0.03510065821017003
Do you think metformin causes a vitamin B deficiency?,0.1760997060890279
What is the difference between concomitant medication and past drugs?,0.055616906343411945
Does pulsed fluoroscopy has more radiation than continuous fluoroscopy?,0.18771715084429177
What kind of endpoints are preffered in phase 3 of a clinical trial?,0.08006572986211695
Can you estimate the impact of switching elderly patients to a drug classified by STOPP criteria?,0.08244774977471499
Where can I learn about the etiology of high blood preassure on the majority of the cases?,0.043891054175471546
What are the possible causes of pleural effusion in a 56yo patient?,0.02338349882781346
How does medications affect the absorption and availability of nutrients in the human body?,0.1413958048012916
What is the mechanism in what tacrolimus acts? ,0.06768030682653828
"In the case of active pyoderma gangrenosum and associated active myeloma with pancytopenia, what approaches could you take when treating? Would there be any benefit in treating one before the other?",0.07254162708108625
What are the lessons we could learn from the different ways hospitals globally mitigated the inpatient spread of Covid 19? Could you summarise the available literature?,0.11930567883691241
Why would a 26 year old female have chronically low cortisol despite already having a cortisol infusion running?,0.10590637367595586
"Suppose a patient is complaining of foul smelling vaginal discharge and burning urination, what is the patient suffering from?",0.05278883897791726
What are the different ways to protect oneself from getting infected with the Covid-19 vaccine?,0.06158831972368594
What do you think about teenage pregnancy?,1.0020694546174735e-78
How much blood is inside a human body?,0.04452724700749821
A family walks in a hospital with different symptoms claiming to suspect TB because of living conditions. What is the first response as the medical team?,0.06280278707107043
"With the brain mainly known for its function as to think, what does the brain do besides think?",0.06848385023585038
When would you advise a patient for bypass instead of stenting and medical therapy?,0.1281718970545124
Define the reasons an exercise stress test would be beneficial to a patient post PCI.,0.11393649028995753
What are the benefits of using myocardial perfusion imaging prior to angio?,0.1243622380590991
Where can I get detailed protocols for microRNA analysis?,0.025240147972792764
MicroRNAs are fairly new with a lot of conflicting findings reported across studies. What is the clinical feasibility of adopting microRNAs as biomarkers for disease diagnosis and prognosis?,0.14144536614664213
What are common causes of iron deficiency?,0.16493698163114762
What are the first rank symptoms of schizophrenia?,9.366613944489684e-79
"A 65 year old patient with severe depression becomes mute. Their oral intake and functioning deteriorates markedly, and their depression appears to be treatment resistant. What treatment would you recommend in this scenario?",0.03418307330752022
"A 25 year old male is 6 months into their recovery journey post-psychotic episode. They are lethargic and motivated, and appear to be presenting with negative symptoms of psychosis. What treatment would you recommend in this instance?",0.027789357346928657
How do bacterial infection predispose one to cancers?,8.739095446151122e-79
How does automation in laboratories affect the final diagnosis produces?,9.7280234669639e-79
"In the United Kingdom, what is the average age of onset for alcohol related dementia?",2.294894159058245e-155
"What is the best way to support a person living with dementia to remain in their own home when they have problems with night time waking, increased falls risk and no family support?",0.12595607892795202
How can I find more information on equipment and adaptations that NHS mental health professionals in the County Durham area can order for their patients?,0.20733322888302216
Imagine you have a patient after knee surgery (14days passed) write me a rehabilitation plan for this patient.,0.032961943794635226
List me 10 basic exercises for pulmonary rehabilitation.,1.0073082227171603e-231
Is there any resources which provide information that using PR threatment in rehabilitation of patients after orthopaedic surgeries is faster than normal?,0.07038022235257081
What would the best option of treatment for a resistent UTI?,0.0711821489329252
What would be the treatment for a post meno patient with breast cancer with no hormone receptors and the patient also has liver damage due to chemo therapy?,0.14600973560879352
What are the best antibiotics for a patient that is allergic to penicilins?,0.038593347782829295
What does the APGAR scale assess?,0.07450813255521971
Briefly list what contributions Antoine Lavoisiere provided to surgery.,6.943922769651298e-79
Describe and justify your opinion about the morality of abortion.,0.04141981968829894
How could I best treat a borderline patient with PTSD who has trouble sleeping but refuses any form of medication other than benzodiazepines?,6.041931399965282e-80
I would like your opinion on acceptance and commitment therapy for personality disorders.,2.0861192842309072e-78
How can I treat a patient suffering from long term depression who is not responding to SSRI’s nor SNRI’s and has diabetes and heart problems?,0.0930693602428685
What is the most expensive chemo drug used in the UK?,7.466898228311088e-79
"When telling patients that their last round of chemo is falling and would advise them to stop chemo, what is the best way to approach my patient when they hoped this last round would work?",4.4740839835060953e-79
What is the method of use for morphine?,0.07206787174379076
Is it suggested to conduct a head CT scan for every head trauma case?,0.05548871558899825
What's the treatment suggested for a four year old with head trauma?,0.12892756989358298
What's the best aproach on panic attack on pediatric patient?,8.393231845568115e-79
Why would a child be removed from their parents care?,0.0816083412540899
"There is another team who I am working alongside but they don't agree with the course of action I have recommended, how do I get them involved?",3.83743781597641e-155
I am working with a family and I am not sure why the parents aren't doing what I have asked them to do. Can you give me some ideas on how to approach this please?,1.1603351983994612e-78
Can a person without one kidney take ibuprofen?,3.538990255639909e-155
"A 70 years old lady come to the pharmacy to take prescription medication, and doesn't know when to take the pills. Where can I guide her to find out that information?",2.068362948621236e-155
An 8 year old kid comes to the pharmacy with a severe rash on the torso. The medical record shows that he already had contact with the varicela-zoster virus. What should be the first approach?,9.047377042573477e-79
"A patient with metastatic lung cancer, currently receiving treatment with carboplatin, paclitaxel, and pembrolizumab develops sudden worsening of dyspnea. What are the possible causes of dyspnea and what would the initial workup include?",0.10653268828877267
"If a 48 year old woman is found to have an esophageal carcinoma that invades the muscularis propria and has regional lymph node metastases but no distant metastasis, what is her stage of cancer and what are possible recommended treatment?",0.06655198661255383
"A patient receiving neoadjuvant FOLFIRINOX for treatment of borderline resectable pancreatic cancer presents for her second cycle of treatment. She complains of uncontrolled nausea with cycle 1 of treatment. She received premedications including Aloxi, aprepitant, dexamethasone, and atropine last cycle, followed by oxaliplatin, irinotecan, leucovorin, and 5FU at 100% recommended dosages. She used zofran and prochlorperazine as needed for nausea at home. What changes to her regimen in clinic or additional medications for home would you recommend to help reduce her nausea with cycle 2?",0.09727118537462795
What does EPRR stand for?,0.21401603033752975
"What at the benefits and consequences of the rise of at-home, or direct-to-patient testing kits in patient care?",0.1257200006525522
What are the ethical implications of increased non-invasive pre-natal testing?,0.03059480564309715
Why do people develop resistance to monoclonal anti-TNF therapies?,0.05910220070349106
What is the clinical use of catecholamine measurement?,0.07261925061709944
"A 45 year old female shows up at a clinic complaining of increased urination, increased taste and more than usual appetite, family history shows fatigue mother was a diabetic and died of complications of diabetes. Patient presented with edema and further examination reveals tremor of fingers following flexion, what is your provisional diagnosis given the clinical picture?",7.888936483048144e-79
"A 65 year old man shows up in the ER with abdominal pain around the center of the tummy, a general feeling of unwellness and  high temperature of 38C or more (fever), what biochemical markers would you recommend for diagnosis and why?",0.07310185923132057
What is the worst case scenario for filler procedure?,0.08999861694751192
What are allergic reactions and what can you do about them?,0.07005132511241444
Consider a scenario where a patient presents with symptoms of both bipolar disorder and borderline personality disorder. How can clinicians accurately differentiate between the two conditions?,0.12400127121023331
Picture a situation where a patient with a history of severe anxiety disorder experiences a sudden loss of a loved one. How can clinicians effectively assess and manage the potential exacerbation of anxiety symptoms during the grieving process?,0.08188638642537295
Antibiotics are usually given to patients who have a bacterial or fungal infection. What about those diseases that are usually caused by a virus?,1.076285942261933e-78
HIV is a viral infection. Describe ways in which one can protect themselves from this virus.,0.11747367713036269
You are understaffed and short in resources and work in trauma how will you determine who gets what and who is referred to another hospital where they would have to go on another queue?,7.585009587747151e-79
How do you deal with hospital rules that can work against your patient if you let your yourself be emotional invested in them an their story?,1.3367499264041667e-78
I have a patient who has prolactin levels 10 times higher than normal but does not have any other altered hormone profile and does not present obvious symptoms. What will be a possible diagnosis?,0.023959997816414787
"I have a patient with rosacea and severe acne, without any other symptoms, conventional treatments have not given results, what other treatment option could be taken?",8.240015530120148e-79
"A 65 year-old woman presents with acute paresthesic pain in her left temple and cheek, suggestive of trigeminal nevralgia. She is already taking carbamazepine because of a personal history of epilepsy. Should the dose of carbamazepine be increased to try and control the pain, or should she be prescribed a different medication for pain control?",0.050887628269430635
"A 68 year-old male with resistant hypertension is already medicated with perindopril, indapamide, amlodipine, bisoprolol and rilmenidine at full dose, yet his blood pressure continues to be too high in the ABMP exam. He is asymptomatic. What should the approach be towards this patient's hypertension?",4.787733109817599e-79
What are the best treatment options for chest infection in patients with penicillin allergy?,7.582733418873616e-79
How would you approach a request to prescribe valproate in women of child bearing age?,0.031546921213950384
"In the field relying on brain psychology, how do they know when the hypothesis is going to give a good result?",3.72580268532215e-155
"The type of drug used for insomnia require prolonged use of them, can't it be solved using psychiatric scans and helmets used to read brain neurons?",8.71416023541802e-79
What are the newly invented medical interventions and treatments provided in an intensive care unit (ICU)?,0.06578117475047084
Many research show that Advanced Nurses Practitioners are more successful in their practice in intensive care. What is your thinking regarding the causes of this?,4.616649576571092e-155
What are the possible areas of brain injury in a patient that has difficulty identifying a keychain visually?,0.05725843046720265
How would you determine the most effective treatment in a resistant infection?,0.06972435890186678
"A patient has high blood pressure reading everytime they go to a doctor's appointment, still the patient claims that when they are at home their blood pressure is always normal. How can we verify if this is true adn what would this mean?",0.15801632787783185
"A patient suffers from diabetes, they were instructed to take insulin everyday for that, even when the patient has been taking the insulin as instructed the blood sugar levels keep increasing. What could be the reason for this?",0.05974525199242485
What first-line tests would you request for the management of sarcoidosis?,0.12715130062027016
"A middle-aged woman starts experiencing a persistent dry cough, fatigue, and shortness of breath. Over time, she also develops skin rashes, swollen lymph nodes, and joint pain. What differential diagnosis could you propose? ",1.0389584031415276e-231
Are HPV-16 and HPV-18 the most common carcinogenic types?,0.14076533690042406
What is the most effective contraceptive method to avoid any type of sexually transmitted disease?,0.20197690703304275
"If a new pandemic arises, do you think that medical technologies and clinical research could have a new therapy against this ""hypothetical"" pandemic on-time?",0.02427399680792807
What is the outstanding role of advanced technologies used in Monitoring of clinical trials?,0.06649364348335596
"A patient with HIV goes to your clinic and you ask for a blood test, what kind of cells are affected?",2.336751314796786e-155
